{
	"$schema": "http://json-schema.org/draft-07/schema#",
	"type": "array",
	"items": {
		"type": "object",
		"properties": {
			"id": {
				"type": "number"
			},
			"name": {
				"type": "string"
			},
			"description": {
				"type": "string"
			},
			"specials": {
				"type": "array",
				"items": {
					"type": "string"
				}
			},
			"buff": {
				"type": "string"
			},
			"effects": {
				"type": "array",
				"items": {
					"type": "object",
					"properties": {
						"subject": {
							"type": "string",
							"enum": [
								"攻撃力",
								"命中",
								"物理与ダメージ率",
								"魔法与ダメージ率",
								"魔法ディレイ",
								"クリティカル率",
								"魔力",
								"攻撃ディレイ",
								"最大HP",
								"最大MP",
								"最大ST",
								"防御力",
								"回避",
								"素手",
								"刀剣",
								"こんぼう",
								"槍",
								"銃器",
								"弓",
								"盾",
								"投げ",
								"牙",
								"罠",
								"キック",
								"戦闘技術",
								"酩酊",
								"物まね",
								"調教",
								"破壊",
								"回復",
								"神秘",
								"召喚",
								"強化",
								"死魔",
								"魔法熟練",
								"自然調和",
								"暗黒命令",
								"取引",
								"シャウト",
								"音楽",
								"盗み",
								"ギャンブル",
								"パフォーマンス",
								"ダンス",
								"ペット経験値率",
								"火属性効果率",
								"水属性効果率",
								"土属性効果率",
								"風属性効果率",
								"無属性効果率",
								"HP自然回復",
								"ST自然回復",
								"MP自然回復",
								"移動速度",
								"水中速度",
								"耐全属性",
								"耐火属性",
								"耐水属性",
								"耐地属性",
								"耐風属性",
								"耐無属性",
								"SEEING",
								"HEARING",
								"SMELLING",
								"最大重量",
								"所持重量",
								"ジャンプ力率",
								"BREATH",
								"料理ゲージ滑り",
								"料理ゲージ速度",
								"料理ヒットゾーン",
								"料理グレードゾーン",
								"料理マスターグレードゾーン",
								"鍛冶ゲージ滑り",
								"鍛冶ゲージ速度",
								"鍛冶ヒットゾーン",
								"鍛冶グレードゾーン",
								"鍛冶マスターグレードゾーン",
								"醸造ゲージ滑り",
								"醸造ゲージ速度",
								"醸造ヒットゾーン",
								"醸造グレードゾーン",
								"醸造マスターグレードゾーン",
								"大工ゲージ滑り",
								"大工ゲージ速度",
								"大工ヒットゾーン",
								"大工グレードゾーン",
								"大工マスターグレードゾーン",
								"裁縫ゲージ滑り",
								"裁縫ゲージ速度",
								"裁縫ヒットゾーン",
								"裁縫グレードゾーン",
								"裁縫マスターグレードゾーン",
								"薬調合ゲージ滑り",
								"薬調合ゲージ速度",
								"薬調合ヒットゾーン",
								"薬調合グレードゾーン",
								"薬調合マスターグレードゾーン",
								"装飾細工ゲージ滑り",
								"装飾細工ゲージ速度",
								"装飾細工ヒットゾーン",
								"装飾細工グレードゾーン",
								"装飾細工マスターグレードゾーン",
								"複製ゲージ滑り",
								"複製ゲージ速度",
								"複製ヒットゾーン",
								"複製グレードゾーン",
								"複製マスターグレードゾーン",
								"栽培ゲージ滑り",
								"栽培ゲージ速度",
								"栽培ヒットゾーン",
								"栽培グレードゾーン",
								"栽培マスターグレードゾーン",
								"美容ゲージ滑り",
								"美容ゲージ速度",
								"美容ヒットゾーン",
								"美容グレードゾーン",
								"美容マスターグレードゾーン",
								"キック命中率補正",
								"キック攻撃力補正",
								"釣りゲージ速度",
								"釣りヒットゾーン",
								"釣りゲージ長",
								"泳ぎ速度",
								"牙命中率補正",
								"牙攻撃補正",
								"盗み補正",
								"潤喉度",
								"満腹度",
								"ピッキング失敗回数補正",
								"ピッキング回転速度補正",
								"攻撃範囲増加"
							]
						},
						"value": {
							"type": "number"
						}
					},
					"required": ["subject", "value"],
					"additionalProperties": false
				}
			},
			"genderAvailable": {
				"type": "string",
				"enum": ["男", "女", "ALL"]
			},
			"tribeAvailable": {
				"type": "string",
				"enum": ["パンデモス", "ニューター", "エルモニー", "コグニート", "ALL"]
			},
			"shipAvailable": {
				"type": "string"
			},
			"type": {
				"type": "string",
				"const": "shields"
			},
			"part": {
				"type": "string",
				"enum": ["右手", "左手"]
			},
			"armorClass": {
				"type": "number"
			},
			"skills": {
				"type": "array",
				"items": {
					"type": "object",
					"properties": {
						"weapon": {
							"type": "string",
							"const": "盾"
						},
						"value": {
							"type": "number"
						}
					},
					"required": ["weapon", "value"],
					"additionalProperties": false
				}
			},
			"avoidance": {
				"type": "number"
			}
		},
		"required": [
			"id",
			"name",
			"description",
			"specials",
			"effects",
			"genderAvailable",
			"tribeAvailable",
			"shipAvailable",
			"type",
			"part",
			"armorClass",
			"skills",
			"avoidance"
		],
		"additionalProperties": false
	}
}
