[
	{
		"id": 595,
		"name": "ウッド バックラー",
		"tribeAvailable": "ALL",
		"genderAvailable": "ALL",
		"shipAvailable": "ALL",
		"description": "円形の木製盾\n小型で軽く　初心者でも扱いやすい",
		"buff": "",
		"specials": ["生産可能"],
		"effects": [],
		"type": "shields",
		"part": "左手",
		"armorClass": 0.8,
		"avoidance": 45,
		"skills": [{ "weapon": "盾", "value": 1 }]
	},
	{
		"id": 601,
		"name": "トレント バックラー",
		"tribeAvailable": "ALL",
		"genderAvailable": "ALL",
		"shipAvailable": "ALL",
		"description": "円形のトレント製盾\n小型で軽く　初心者でも扱いやすい",
		"buff": "",
		"specials": ["生産可能"],
		"effects": [
			{ "subject": "耐無属性", "value": 2 },
			{ "subject": "耐火属性", "value": 2 },
			{ "subject": "耐水属性", "value": 2 },
			{ "subject": "耐風属性", "value": 2 },
			{ "subject": "耐地属性", "value": 2 }
		],
		"type": "shields",
		"part": "左手",
		"armorClass": 1,
		"avoidance": 45,
		"skills": [{ "weapon": "盾", "value": 1 }]
	},
	{
		"id": 602,
		"name": "レザー シールド",
		"tribeAvailable": "ALL",
		"genderAvailable": "ALL",
		"shipAvailable": "ALL",
		"description": "柔らかい皮で作られた盾\n小型で軽く　初心者でも扱いやすい",
		"buff": "",
		"specials": ["生産可能"],
		"effects": [],
		"type": "shields",
		"part": "左手",
		"armorClass": 1.7,
		"avoidance": 35,
		"skills": [{ "weapon": "盾", "value": 11 }]
	},
	{
		"id": 605,
		"name": "ドラゴン シールド",
		"tribeAvailable": "ALL",
		"genderAvailable": "ALL",
		"shipAvailable": "ALL",
		"description": "ドラゴンの皮で作られた盾\n小型で軽量だが非常に高い防御力を誇る",
		"buff": "",
		"specials": ["生産可能"],
		"effects": [{ "subject": "耐火属性", "value": 5 }],
		"type": "shields",
		"part": "左手",
		"armorClass": 3,
		"avoidance": 35,
		"skills": [{ "weapon": "盾", "value": 16 }]
	},
	{
		"id": 607,
		"name": "カッパー カイト シールド",
		"tribeAvailable": "ALL",
		"genderAvailable": "ALL",
		"shipAvailable": "ALL",
		"description": "銅製の盾\n特殊なデザインが施されている\n耐久性に優れる",
		"buff": "",
		"specials": ["生産可能"],
		"effects": [],
		"type": "shields",
		"part": "左手",
		"armorClass": 3.9,
		"avoidance": 25,
		"skills": [{ "weapon": "盾", "value": 31 }]
	},
	{
		"id": 608,
		"name": "ブロンズ カイト シールド",
		"tribeAvailable": "ALL",
		"genderAvailable": "ALL",
		"shipAvailable": "ALL",
		"description": "青銅製の盾\n特殊なデザインが施されている",
		"buff": "",
		"specials": ["生産可能"],
		"effects": [],
		"type": "shields",
		"part": "左手",
		"armorClass": 4.3,
		"avoidance": 25,
		"skills": [{ "weapon": "盾", "value": 31 }]
	},
	{
		"id": 609,
		"name": "アイアン カイト シールド",
		"tribeAvailable": "ALL",
		"genderAvailable": "ALL",
		"shipAvailable": "ALL",
		"description": "鉄製の盾\n特殊なデザインが施されている",
		"buff": "",
		"specials": ["生産可能"],
		"effects": [],
		"type": "shields",
		"part": "左手",
		"armorClass": 4.5,
		"avoidance": 25,
		"skills": [{ "weapon": "盾", "value": 31 }]
	},
	{
		"id": 610,
		"name": "スチール カイト シールド",
		"tribeAvailable": "ALL",
		"genderAvailable": "ALL",
		"shipAvailable": "ALL",
		"description": "鋼鉄製の盾\n特殊なデザインが施されている",
		"buff": "",
		"specials": ["生産可能"],
		"effects": [],
		"type": "shields",
		"part": "左手",
		"armorClass": 4.9,
		"avoidance": 25,
		"skills": [{ "weapon": "盾", "value": 31 }]
	},
	{
		"id": 611,
		"name": "シルバー カイト シールド",
		"tribeAvailable": "ALL",
		"genderAvailable": "ALL",
		"shipAvailable": "ALL",
		"description": "銀製の盾\n特殊なデザインが施されている\nアンデッド系に有効",
		"buff": "",
		"specials": ["生産可能"],
		"effects": [],
		"type": "shields",
		"part": "左手",
		"armorClass": 4.6,
		"avoidance": 25,
		"skills": [{ "weapon": "盾", "value": 31 }]
	},
	{
		"id": 612,
		"name": "ゴールド カイト シールド",
		"tribeAvailable": "ALL",
		"genderAvailable": "ALL",
		"shipAvailable": "ALL",
		"description": "金製の盾\n特殊なデザインが施されている",
		"buff": "",
		"specials": ["生産可能"],
		"effects": [{ "subject": "最大HP", "value": 1 }],
		"type": "shields",
		"part": "左手",
		"armorClass": 4.8,
		"avoidance": 25,
		"skills": [{ "weapon": "盾", "value": 31 }]
	},
	{
		"id": 614,
		"name": "ミスリル カイト シールド",
		"tribeAvailable": "ALL",
		"genderAvailable": "ALL",
		"shipAvailable": "ALL",
		"description": "ミスリル製の盾\n特殊なデザインが施されている",
		"buff": "",
		"specials": ["強化可能", "生産可能"],
		"effects": [],
		"type": "shields",
		"part": "左手",
		"armorClass": 4.7,
		"avoidance": 25,
		"skills": [{ "weapon": "盾", "value": 31 }]
	},
	{
		"id": 615,
		"name": "オリハルコン カイト シールド",
		"tribeAvailable": "ALL",
		"genderAvailable": "ALL",
		"shipAvailable": "ALL",
		"description": "オリハルコン製の盾\n特殊なデザインが施されている",
		"buff": "",
		"specials": ["生産可能"],
		"effects": [{ "subject": "攻撃力", "value": 1 }],
		"type": "shields",
		"part": "左手",
		"armorClass": 6,
		"avoidance": 25,
		"skills": [{ "weapon": "盾", "value": 31 }]
	},
	{
		"id": 617,
		"name": "カッパー タワー シールド",
		"tribeAvailable": "ALL",
		"genderAvailable": "ALL",
		"shipAvailable": "ALL",
		"description": "銅製の長盾\n完全回避率とダメージ軽減のバランスが良い\n耐久性に優れる",
		"buff": "",
		"specials": ["生産可能"],
		"effects": [],
		"type": "shields",
		"part": "左手",
		"armorClass": 6.5,
		"avoidance": 15,
		"skills": [{ "weapon": "盾", "value": 51 }]
	},
	{
		"id": 618,
		"name": "ブロンズ タワー シールド",
		"tribeAvailable": "ALL",
		"genderAvailable": "ALL",
		"shipAvailable": "ALL",
		"description": "青銅製の長盾\n完全回避率とダメージ軽減のバランスが良い",
		"buff": "",
		"specials": ["生産可能"],
		"effects": [],
		"type": "shields",
		"part": "左手",
		"armorClass": 6.8,
		"avoidance": 15,
		"skills": [{ "weapon": "盾", "value": 51 }]
	},
	{
		"id": 619,
		"name": "アイアン タワー シールド",
		"tribeAvailable": "ALL",
		"genderAvailable": "ALL",
		"shipAvailable": "ALL",
		"description": "鉄製の長盾\n完全回避率とダメージ軽減のバランスが良い",
		"buff": "",
		"specials": ["生産可能"],
		"effects": [],
		"type": "shields",
		"part": "左手",
		"armorClass": 7.1,
		"avoidance": 15,
		"skills": [{ "weapon": "盾", "value": 51 }]
	},
	{
		"id": 620,
		"name": "スチール タワー シールド",
		"tribeAvailable": "ALL",
		"genderAvailable": "ALL",
		"shipAvailable": "ALL",
		"description": "鋼鉄製の長盾\n完全回避率とダメージ軽減のバランスが良い",
		"buff": "",
		"specials": ["生産可能"],
		"effects": [],
		"type": "shields",
		"part": "左手",
		"armorClass": 7.4,
		"avoidance": 15,
		"skills": [{ "weapon": "盾", "value": 51 }]
	},
	{
		"id": 621,
		"name": "シルバー タワー シールド",
		"tribeAvailable": "ALL",
		"genderAvailable": "ALL",
		"shipAvailable": "ALL",
		"description": "銀製の長盾\n完全回避率とダメージ軽減のバランスが良い\nアンデッド系に有効",
		"buff": "",
		"specials": ["生産可能"],
		"effects": [],
		"type": "shields",
		"part": "左手",
		"armorClass": 7.2,
		"avoidance": 15,
		"skills": [{ "weapon": "盾", "value": 51 }]
	},
	{
		"id": 622,
		"name": "ゴールド タワー シールド",
		"tribeAvailable": "ALL",
		"genderAvailable": "ALL",
		"shipAvailable": "ALL",
		"description": "金製の長盾\n完全回避率とダメージ軽減のバランスが良い",
		"buff": "",
		"specials": ["生産可能"],
		"effects": [{ "subject": "最大HP", "value": 1 }],
		"type": "shields",
		"part": "左手",
		"armorClass": 7.3,
		"avoidance": 15,
		"skills": [{ "weapon": "盾", "value": 51 }]
	},
	{
		"id": 624,
		"name": "ミスリル タワー シールド",
		"tribeAvailable": "ALL",
		"genderAvailable": "ALL",
		"shipAvailable": "ALL",
		"description": "ミスリル製の長盾\n完全回避率とダメージ軽減のバランスが良い",
		"buff": "",
		"specials": ["強化可能", "生産可能"],
		"effects": [],
		"type": "shields",
		"part": "左手",
		"armorClass": 7.3,
		"avoidance": 15,
		"skills": [{ "weapon": "盾", "value": 51 }]
	},
	{
		"id": 625,
		"name": "オリハルコン タワー シールド",
		"tribeAvailable": "ALL",
		"genderAvailable": "ALL",
		"shipAvailable": "ALL",
		"description": "オリハルコン製の長盾\n完全回避率とダメージ軽減のバランスが良い",
		"buff": "",
		"specials": ["生産可能"],
		"effects": [{ "subject": "攻撃力", "value": 1 }],
		"type": "shields",
		"part": "左手",
		"armorClass": 8.6,
		"avoidance": 15,
		"skills": [{ "weapon": "盾", "value": 51 }]
	},
	{
		"id": 627,
		"name": "カッパー ウォー シールド",
		"tribeAvailable": "ALL",
		"genderAvailable": "ALL",
		"shipAvailable": "ALL",
		"description": "銅製の盾\n体を覆い隠すほどの大きさがある\n耐久性に優れる",
		"buff": "",
		"specials": ["生産可能"],
		"effects": [],
		"type": "shields",
		"part": "左手",
		"armorClass": 9.9,
		"avoidance": 5,
		"skills": [{ "weapon": "盾", "value": 71 }]
	},
	{
		"id": 628,
		"name": "ブロンズ ウォー シールド",
		"tribeAvailable": "ALL",
		"genderAvailable": "ALL",
		"shipAvailable": "ALL",
		"description": "青銅製の盾\n体を覆い隠すほどの大きさがある",
		"buff": "",
		"specials": ["生産可能"],
		"effects": [],
		"type": "shields",
		"part": "左手",
		"armorClass": 10.3,
		"avoidance": 5,
		"skills": [{ "weapon": "盾", "value": 71 }]
	},
	{
		"id": 629,
		"name": "アイアン ウォー シールド",
		"tribeAvailable": "ALL",
		"genderAvailable": "ALL",
		"shipAvailable": "ALL",
		"description": "鉄製の盾\n体を覆い隠すほどの大きさがある",
		"buff": "",
		"specials": ["生産可能"],
		"effects": [],
		"type": "shields",
		"part": "左手",
		"armorClass": 10.5,
		"avoidance": 5,
		"skills": [{ "weapon": "盾", "value": 71 }]
	},
	{
		"id": 630,
		"name": "シルバー ウォー シールド",
		"tribeAvailable": "ALL",
		"genderAvailable": "ALL",
		"shipAvailable": "ALL",
		"description": "銀製の盾\n体を覆い隠すほどの大きさがある\nアンデッド系に有効",
		"buff": "",
		"specials": ["生産可能"],
		"effects": [],
		"type": "shields",
		"part": "左手",
		"armorClass": 10.6,
		"avoidance": 5,
		"skills": [{ "weapon": "盾", "value": 71 }]
	},
	{
		"id": 631,
		"name": "ゴールド ウォー シールド",
		"tribeAvailable": "ALL",
		"genderAvailable": "ALL",
		"shipAvailable": "ALL",
		"description": "金製の盾\n体を覆い隠すほどの大きさがある",
		"buff": "",
		"specials": ["生産可能"],
		"effects": [{ "subject": "最大HP", "value": 1 }],
		"type": "shields",
		"part": "左手",
		"armorClass": 10.8,
		"avoidance": 5,
		"skills": [{ "weapon": "盾", "value": 71 }]
	},
	{
		"id": 632,
		"name": "スチール ウォー シールド",
		"tribeAvailable": "ALL",
		"genderAvailable": "ALL",
		"shipAvailable": "ALL",
		"description": "鋼鉄製の盾\n体を覆い隠すほどの大きさがある",
		"buff": "",
		"specials": ["生産可能"],
		"effects": [],
		"type": "shields",
		"part": "左手",
		"armorClass": 10.9,
		"avoidance": 5,
		"skills": [{ "weapon": "盾", "value": 71 }]
	},
	{
		"id": 634,
		"name": "ミスリル ウォー シールド",
		"tribeAvailable": "ALL",
		"genderAvailable": "ALL",
		"shipAvailable": "ALL",
		"description": "ミスリル製の盾\n体を覆い隠すほどの大きさがある",
		"buff": "",
		"specials": ["強化可能", "生産可能"],
		"effects": [],
		"type": "shields",
		"part": "左手",
		"armorClass": 10.7,
		"avoidance": 5,
		"skills": [{ "weapon": "盾", "value": 71 }]
	},
	{
		"id": 635,
		"name": "オリハルコン ウォー シールド",
		"tribeAvailable": "ALL",